{
  "id": "ct-public-large-001",
  "name": "Public Sector – Large Agency",
  "description": "Typical baseline coverage for large, compliance-driven public agencies.",
  "sector": "Government",
  "sizeCategory": "large",
  "expectations": [
    {
      "domain": "Policy",
      "targetCoverageLevel": "governed"
    },
    {
      "domain": "Capability",
      "targetCoverageLevel": "analysed"
    },
    {
      "domain": "Performance",
      "targetCoverageLevel": "documented"
    }
  ],
  "createdBy": "system@orthogramic.com",
  "createdAt": "2025-06-01T12:00:00Z"
}
